{
  "$schema": "https://json-schema.org/draft/2020-12/schema",
  "$id": "https://wambe.africa/contracts/staging-evidence-v1.1.schema.json",
  "title": "Wambe staging release evidence v1.1",
  "description": "Redacted, machine-checkable evidence for the US-004 staging-readiness decision. This schema validates structure, not redaction or release readiness.",
  "type": "object",
  "additionalProperties": false,
  "required": [
    "schemaVersion",
    "storyId",
    "environment",
    "release",
    "findings",
    "controls"
  ],
  "properties": {
    "schemaVersion": {
      "const": "1.1"
    },
    "storyId": {
      "const": "US-004"
    },
    "environment": {
      "const": "staging"
    },
    "release": {
      "$ref": "#/$defs/release"
    },
    "findings": {
      "type": "array",
      "minItems": 5,
      "maxItems": 5,
      "items": {
        "$ref": "#/$defs/findingEvidence"
      }
    },
    "controls": {
      "type": "array",
      "minItems": 42,
      "maxItems": 42,
      "items": {
        "$ref": "#/$defs/controlEvidence"
      }
    }
  },
  "$defs": {
    "release": {
      "type": "object",
      "additionalProperties": false,
      "required": [
        "repository",
        "commit"
      ],
      "properties": {
        "repository": {
          "const": "yabdev/wambe"
        },
        "branch": {
          "type": "string",
          "minLength": 1,
          "maxLength": 200
        },
        "commit": {
          "type": "string",
          "pattern": "^[a-f0-9]{40,64}$"
        },
        "ciWorkflowReference": {
          "type": "string",
          "minLength": 1,
          "maxLength": 500
        },
        "securityWorkflowReference": {
          "type": "string",
          "minLength": 1,
          "maxLength": 500
        },
        "apiImageDigest": {
          "type": "string",
          "pattern": "^sha256:[a-f0-9]{64}$"
        },
        "scannerImageDigest": {
          "type": "string",
          "pattern": "^sha256:[a-f0-9]{64}$"
        },
        "vercelDeploymentId": {
          "type": "string",
          "minLength": 1,
          "maxLength": 200
        }
      }
    },
    "findingEvidence": {
      "type": "object",
      "additionalProperties": false,
      "required": [
        "findingId",
        "status"
      ],
      "properties": {
        "findingId": {
          "enum": [
            "QA-001",
            "SEC-011",
            "SEC-012",
            "SEC-013",
            "SEC-014"
          ]
        },
        "status": {
          "enum": [
            "OPEN",
            "CLOSED"
          ]
        },
        "timestampUtc": {
          "type": "string",
          "format": "date-time"
        },
        "reviewerRole": {
          "enum": [
            "QA",
            "Security"
          ]
        },
        "reviewerReference": {
          "type": "string",
          "minLength": 1,
          "maxLength": 200
        },
        "sourceReferences": {
          "type": "array",
          "minItems": 1,
          "uniqueItems": true,
          "items": {
            "type": "string",
            "minLength": 1,
            "maxLength": 500
          }
        },
        "outcome": {
          "type": "string",
          "minLength": 1,
          "maxLength": 1000
        }
      },
      "allOf": [
        {
          "if": {
            "properties": {
              "status": {
                "const": "CLOSED"
              }
            },
            "required": [
              "status"
            ]
          },
          "then": {
            "required": [
              "timestampUtc",
              "reviewerRole",
              "reviewerReference",
              "sourceReferences",
              "outcome"
            ]
          }
        }
      ]
    },
    "controlEvidence": {
      "type": "object",
      "additionalProperties": false,
      "required": [
        "controlId",
        "status"
      ],
      "properties": {
        "controlId": {
          "type": "string",
          "pattern": "^[A-Z0-9][A-Z0-9._-]{1,63}$"
        },
        "status": {
          "enum": [
            "NOT_RUN",
            "IN_PROGRESS",
            "PASS",
            "FAIL",
            "BLOCKED",
            "WAIVED"
          ]
        },
        "timestampUtc": {
          "type": "string",
          "format": "date-time"
        },
        "reviewerRole": {
          "enum": [
            "Backend",
            "Frontend",
            "QA",
            "Security",
            "Operations",
            "Product Owner"
          ]
        },
        "reviewerReference": {
          "type": "string",
          "minLength": 1,
          "maxLength": 200
        },
        "sourceReferences": {
          "type": "array",
          "minItems": 1,
          "uniqueItems": true,
          "items": {
            "type": "string",
            "minLength": 1,
            "maxLength": 500
          }
        },
        "outcome": {
          "type": "string",
          "minLength": 1,
          "maxLength": 1000
        },
        "defectReference": {
          "type": "string",
          "minLength": 1,
          "maxLength": 200
        },
        "blockerReference": {
          "type": "string",
          "minLength": 1,
          "maxLength": 200
        },
        "decisionReference": {
          "type": "string",
          "minLength": 1,
          "maxLength": 200
        }
      },
      "allOf": [
        {
          "if": {
            "properties": {
              "status": {
                "not": {
                  "const": "NOT_RUN"
                }
              }
            },
            "required": [
              "status"
            ]
          },
          "then": {
            "required": [
              "timestampUtc",
              "reviewerRole",
              "reviewerReference",
              "sourceReferences",
              "outcome"
            ]
          }
        },
        {
          "if": {
            "properties": {
              "status": {
                "const": "FAIL"
              }
            },
            "required": [
              "status"
            ]
          },
          "then": {
            "required": [
              "defectReference"
            ]
          }
        },
        {
          "if": {
            "properties": {
              "status": {
                "const": "BLOCKED"
              }
            },
            "required": [
              "status"
            ]
          },
          "then": {
            "required": [
              "blockerReference"
            ]
          }
        },
        {
          "if": {
            "properties": {
              "status": {
                "const": "WAIVED"
              }
            },
            "required": [
              "status"
            ]
          },
          "then": {
            "required": [
              "decisionReference"
            ]
          }
        }
      ]
    }
  }
}
