{
  "schemaVersion": "1.1",
  "storyId": "US-004",
  "environment": "staging",
  "release": {
    "repository": "yabdev/wambe",
    "commit": "0000000000000000000000000000000000000000"
  },
  "findings": [
    { "findingId": "QA-001", "status": "OPEN" },
    { "findingId": "SEC-011", "status": "OPEN" },
    { "findingId": "SEC-012", "status": "OPEN" },
    { "findingId": "SEC-013", "status": "OPEN" },
    { "findingId": "SEC-014", "status": "OPEN" }
  ],
  "controls": [
    { "controlId": "BUILD-001", "status": "NOT_RUN" },
    { "controlId": "BUILD-002", "status": "NOT_RUN" },
    { "controlId": "BUILD-003", "status": "NOT_RUN" },
    { "controlId": "BUILD-004", "status": "NOT_RUN" },
    { "controlId": "BUILD-005", "status": "NOT_RUN" },
    { "controlId": "SECURITY-001", "status": "NOT_RUN" },
    { "controlId": "SECURITY-002", "status": "NOT_RUN" },
    { "controlId": "SECURITY-003", "status": "NOT_RUN" },
    { "controlId": "SECURITY-004", "status": "NOT_RUN" },
    { "controlId": "SECURITY-005", "status": "NOT_RUN" },
    { "controlId": "AUTH-001", "status": "NOT_RUN" },
    { "controlId": "AUTH-002", "status": "NOT_RUN" },
    { "controlId": "AUTH-003", "status": "NOT_RUN" },
    { "controlId": "AUTH-004", "status": "NOT_RUN" },
    { "controlId": "AUTH-005", "status": "NOT_RUN" },
    { "controlId": "AUTH-006", "status": "NOT_RUN" },
    { "controlId": "MEDIA-001", "status": "NOT_RUN" },
    { "controlId": "MEDIA-002", "status": "NOT_RUN" },
    { "controlId": "MEDIA-003", "status": "NOT_RUN" },
    { "controlId": "MEDIA-004", "status": "NOT_RUN" },
    { "controlId": "MEDIA-005", "status": "NOT_RUN" },
    { "controlId": "MEDIA-006", "status": "NOT_RUN" },
    { "controlId": "MEDIA-007", "status": "NOT_RUN" },
    { "controlId": "SHARE-001", "status": "NOT_RUN" },
    { "controlId": "SHARE-002", "status": "NOT_RUN" },
    { "controlId": "SHARE-003", "status": "NOT_RUN" },
    { "controlId": "SHARE-004", "status": "NOT_RUN" },
    { "controlId": "SHARE-005", "status": "NOT_RUN" },
    { "controlId": "RECOVERY-001", "status": "NOT_RUN" },
    { "controlId": "RECOVERY-002", "status": "NOT_RUN" },
    { "controlId": "RECOVERY-003", "status": "NOT_RUN" },
    { "controlId": "RECOVERY-004", "status": "NOT_RUN" },
    { "controlId": "RECOVERY-005", "status": "NOT_RUN" },
    { "controlId": "RECOVERY-006", "status": "NOT_RUN" },
    { "controlId": "RECOVERY-007", "status": "NOT_RUN" },
    { "controlId": "OPS-001", "status": "NOT_RUN" },
    { "controlId": "OPS-002", "status": "NOT_RUN" },
    { "controlId": "OPS-003", "status": "NOT_RUN" },
    { "controlId": "OPS-004", "status": "NOT_RUN" },
    { "controlId": "OPS-005", "status": "NOT_RUN" },
    { "controlId": "OPS-006", "status": "NOT_RUN" },
    { "controlId": "OPS-007", "status": "NOT_RUN" }
  ]
}
